date,url,title,author,email_contact,content
October 31 2024,https://www.ars.usda.gov/news-events/news/research-news/2024/ars-hosts-30th-anniversary-ceremony-for-usda-george-e-brown-jr-salinity-laboratory/,"ARS Hosts 30th Anniversary Ceremony for USDA George E. Brown, Jr. Salinity Laboratory",Amaani Lyle,Amaani.Lyle@usda.gov,"The event celebrated decades of research at the laboratory, where ARS teams have pioneered irrigation practices to optimize crop production, leverage conservation through recycled water, and minimize land degradation caused by the omnipresence of natural and man-made salinization, the overabundance of salt. Salinization is the buildup of salts and other trace elements in irrigated soils that reduces the productivity of croplands, constituting a long-standing threat to farming in the semi-arid regions of the American West, parts of the Midwest, and throughout the world. The Salinity Laboratory’s innovation and leadership in understanding salt-affected soil-plant-water systems for the conservation and protection of our land and water resources and the maintenance of a viable, permanent irrigated agriculture has garnered acclaim from both USDA leadership and UC Riverside collaborators. “This milestone anniversary of the U.S. Department of Agriculture George E. Brown, Jr., Salinity Laboratory marks a storied history of our mission to overcome water quality and water scarcity constraints on agriculture and human health,” said Dr. Simon Liu, ARS Administrator. “Our researchers’ work has yielded palpable solutions to address climate change, drought, and competition for resources -- factors that reduce the availability of irrigation water and compound risks posed by salinization.” ARS Research Leader Todd Skaggs echoed the importance of appropriate salinity control. “To meet increasing demands for food amid limited soil and water resources, the nation and much of the world community will continue to look to the USDA Salinity Laboratory for salinity expertise, water quality research, and applications to solve these problems,” Skaggs said. “Protection of soil resources will become even more vital as water conservation, efficiency and quality assurance continue to increase.” According to Skaggs, current research focus areas have earned the lab a vanguard position in addressing and eradicating per- and poly-fluoroalkyl substances (PFAS), chemicals of concern whose presence in recycled water may lead to the introduction of these harmful compounds into the human food chain if such waters are used for agricultural crop irrigation. “Even low levels of PFAS may accumulate in soils over time and be absorbed by crop roots,” Skaggs explained. “Our team is therefore developing a low-cost, low-energy, environmentally-friendly treatment system for the removal of PFAS from recycled water, and it’s being optimized for application at the greenhouse scale, potentially allowing for production of PFAS-free crops for human consumption.” Skaggs also recounted research inflection points in the 1960s and 1970s when ARS scientists quantified the salinity response of a wide variety of agricultural crops and demonstrated that soil salinity could be managed with significantly less water than used in conventional irrigation practices, setting the stage for substantial water conservation. “This research enabled the selection of suitable crops for a given irrigation water quality and the data remain the most comprehensive information available on relative crop salt tolerances,” he said. By the 1990s, the Salinity Laboratory developed benchmark methods for mapping and monitoring soil salinity across swaths of U.S. farms and agricultural regions, irrigated lands that produce 30% of the nation's food and fiber and practically all of the nation's fruits and vegetables. The 30th anniversary ceremony highlighted but a fraction of the lab’s deep roots. In 1937, the United States Regional Salinity Laboratory was established at the base of Mount Rubidoux in the city of Riverside before adopting a new moniker, United States Salinity Laboratory, in 1951.  In 1986, Congressmen George Brown, Jerry Lewis, and Al McCandless of California introduced legislation to replace the aging U.S. Salinity Laboratory with a modern facility on the UCR campus, which supported the project by leasing to the federal government a 7.5-acre site for 50 years at $1 per year. Groundbreaking occurred in 1992 before the facility officially opened in 1995.  In 2000, the laboratory name would change once more to George E. Brown, Jr., Salinity Laboratory in memory of Congressman George E. Brown, Jr. The laboratory has the distinction of being the only facility in the country specifically devoted to agricultural and environmental issue analysis through basic research on saline and alkali soils, including related reclamation, irrigation, drainage and soil management.   Following the ceremony was an open house highlighting current research including breeding of salt-tolerant alfalfa, precision agriculture, and greenhouse-scale treatment systems for removing PFAS from irrigation water. ARS and UC Riverside researchers have maintained collaborative relationships, sharing vital resources to achieve common research objectives through cooperative research programs.  Leaders who spoke at the ceremony included: The Agricultural Research Service is the U.S. Department of Agriculture's chief scientific in-house research agency. Daily, ARS focuses on solutions to agricultural problems affecting America. Each dollar invested in U.S. agricultural research results in $20 of economic impact. "
October 29 2024,https://www.ars.usda.gov/news-events/news/research-news/2024/usda-s-agricultural-research-technology-center-breaks-ground-in-davis-ca/,"USDA’s Agricultural Research Technology Center Breaks Ground in Davis, CA",Amaani Lyle,Amaani.Lyle@usda.gov,"The Agricultural Research and Technology Center (ARTC) is a cutting-edge facility that will include customized laboratories, greenhouses and capacity for scientists as part of the ARS’s ongoing efforts to mitigate and adapt to climate change, water scarcity, emerging pests, and increasing global need in support of a resilient agricultural production system. The two-story 59,000 square foot building will house four ARS research units: Crops Pathology and Genetics, Invasive Species and Pollinator Health, National Clonal Germplasm Repository - Tree Fruit and Nut Crops and Grapes, and Sustainable Agricultural Water Systems. Collectively, these units improve the health, sustainability, and profitability of agricultural production and natural resources in California and the Western United States. “The building will be a nexus for scientists to investigate plant diseases, plant genetic resources, conventional and advanced plant breeding methods, soil health, invasive species management and myriad other areas driven by long-term agricultural research and climate-informed decision-making strategies,” said Dr. Simon Liu, ARS Administrator. A rendering of the new Agricultural Research and Technology Center in Davis, California. (Image courtesy of Burns & McDonnell) Collaborations between ARS, USDA’s chief in-house research agency, and UC Davis began in 1956 with the location of the Crops Pathology and Genetics Research Unit (CPGRU) led by ARS Plant Pathologist, Dr. Austin Goheen, on campus to research grape viruses. ARS scientists have since fanned across several UC Davis departments, including Plant Pathology, Viticulture and Enology; Entomology and Nematology; Plant Sciences; and Land, Air and Water Resources, which has facilitated many collaborations that have benefited various stakeholders in industries that include almond, walnut, rice, and grapes. ARS’s presence on campus has since grown to over 30 scientists with supporting staff across the four research units and the Western Human Nutrition Research Center. Strong collaborative research efforts between university extension specialists, farm advisors, and faculty will continue with the move to the ARTC. “This research will benefit growers, commodity groups, agricultural businesses, and U.S. consumers who rely on ARS to find solutions to agricultural and environmental problems,” said Dr. Amisha Poret-Peterson, CPGRU Acting Research Leader. “It’s incredible to celebrate current and future cooperative research among ARS, groundwater sustainability agencies, UC Davis researchers, and stakeholders in diverse specialty realms such as tree nut, rice, and beekeeping industries.” ARS remains committed to nationwide infrastructure modernization, empowering researchers to address agricultural challenges from animal science and crop production to climate change and sustainable farming practices. Notable speakers at the groundbreaking ceremony included: The Agricultural Research Service is the U.S. Department of Agriculture's chief scientific in-house research agency. Daily, ARS focuses on solutions to agricultural problems affecting America. Each dollar invested in U.S. agricultural research results in $20 of economic impact. "
October 16 2024,https://www.ars.usda.gov/news-events/news/research-news/2024/agricultural-research-service-develops-long-term-roadmap-for-pfas-in-us-agriculture/,Agricultural Research Service Develops Long-Term Roadmap for PFAS in U.S. Agriculture,Autumn Canaday,Email not found,"ARS, its Center of Excellence for Environmental Monitoring and Mitigation, and the University Maine, collaborated recently during a three-day workshop to bring together more than 150 interagency researchers, state partners, university partners and other subject matter experts to engage in discussion and identify key research and innovative solutions that address the top challenges PFAS poses to agriculture, agroecosystems, food systems, and farming communities. Many within the agricultural community are facing new challenges when PFAS chemicals are detected within their farms, resulting in this being a new challenge to farmers’ continued capacity to sustain healthy soil and water on their farms, as well as continued capacity to provide safe and dependable food and fiber supplies to our nation and the world. The suggested long-term roadmap solutions for improving these circumstances include finding new means of detecting when PFAS contamination is a problem, better understanding of how it moves through the agricultural system, and innovating new ways to interrupt that movement or remove the chemicals before they can do harm. Other topics of discussion at the workshop included a strategy for data standardization and integration, how to develop scientific solutions to management of municipal biosolids, and ways of effectively removing existing PFAS chemicals from the production environment. “The meeting’s focus on the gap between PFAS challenges and solutions has empowered and offered hope to ARS, its partners and sister agencies - to address and resolve agriculture-centric problems arising from the use of PFAS in our communities and everyday consumer products,” said ARS Senior Management Advisor, Dr. David Knaebel. “The workshop’s overarching impact will assist the U.S. agricultural research community and stakeholders to find creative and innovative ways to mitigate and remediate a rapidly growing PFAS challenge in U.S. agriculture and food systems.” PFAS is a class of man-made chemicals that have been manufactured and used in a variety of industries around the globe, including in the United States, since the 1940s. The chemical has been placed in the category of “forever chemicals’ because they bioaccumulate in animals and plants and do not breakdown naturally in the animals or plants or in the environment. These chemicals in agricultural landscapes can cause food producers numerous challenges that require innovative scientific solutions from agriculture research, research and developments, and strategic partnerships. “Currently, our data shows that PFAS is an environmental hazard that does not come from agriculture,” said Acting Assistant Administrator Marlen Eve. “But, producers need efficient, cost-effective ways to deal with the challenges when it is detected in our agricultural soils and waters.” Federal and stakeholder workshop attendees plan to move forward with next steps by crafting documents that will communicate solutions to the ag research community – especially in locations where PFAS has critical impacts on agriculture – and to engage in partnerships to realize those research solutions into impactful tools and practices for producers and the agricultural community. ""The University of Maine is pleased to expand our partnership with USDA ARS to find solutions to this national environmental crisis. With our collective expertise — supported by the ingenuity and resolve of our researchers and students — we can accelerate breakthroughs in basic and applied science that will result in new tools and strategies for protecting food systems in Maine and beyond."" said Joan Ferrini-Mundy, Vice Chancellor for Research and Innovation for the University of Maine System and President of the University of Maine.  ""Together, we will also expand each other's research capacities, grant funding efforts and infrastructure, all of which will be essential for mitigating the spread of PFAS and other toxic compounds like it. Thank you to U.S. Senator Susan Collins for securing funding for the Center and for her ongoing support of research informing practical solutions for rural farmers and communities."" ARS will continue to expand its PFAS research to address its impact on U.S. agriculture. Future research will ensure that the nation maintains a safe and abundant high quality food supply that is undergirded by sustainable natural resources. The Agricultural Research Service is the U.S. Department of Agriculture's chief scientific in-house research agency. Daily, ARS focuses on solutions to agricultural problems affecting America. Each dollar invested in U.S. agricultural research results in $20 of economic impact. "
October 15 2024,https://www.ars.usda.gov/news-events/news/research-news/2024/new-oat-ready-for-active-duty-against-crown-rust-disease/,New Oat Ready for Active Duty Against Crown Rust Disease,Jan Suszkiw,Jan.Suszkiw@usda.gov,"A team of Agricultural Research Service (ARS) and university scientists has released two new oat germplasm lines to shore up the cereal crop’s defenses against its most devastating fungal disease, known as “crown rust.” The team specifically created the oat lines so that they can be crossed with elite commercial varieties to fortify them with new genetic sources of resistance to crown rust, which is caused by the fungus Puccinia coronata f. sp. avenae. Crown rust is a plague of oat worldwide and can inflict grain yield losses of up to 50 percent in unprotected crops. The team announced its development of the resistant oat germplasm lines—dubbed CDL-111 and CDL-167—in the May 2024 issue of the Journal of Plant Registration, culminating more than 25 years of germplasm screening, plant genetic mapping, selective breeding and evaluation in greenhouse and field trials. “Currently, the majority of the oat varieties with rust resistance carry a gene or two for resistance (often referred to as seedling resistance) to a specific isolate of crown rust,” said Shahryar Kianian, a co-author on the journal paper and research leader of the ARS Cereal Diseases Laboratory in St. Paul, Minnesota. However, the crown rust fungus is a genetically diverse pathogen and highly adept at evolving into virulent new forms, called races. This can happen so quickly that the average productive life of an oat variety with seedling resistance is between three and five years, necessitating the use of chemical fungicides in conventional production systems. Unchecked, the fungus infects the lower leaves and sometimes the sheafs of vulnerable oat plants, forming round- to oval-shaped pustules packed with masses of orangish spores that can be carried away by wind or rain. Damage to leaves can diminish photosynthesis and disrupt the movement of sugars from the leaves to developing grain, shriveling it and reducing feed value. . ARS and university scientists have released two new lines of oat to better fortify this important grain crop’s defense against the fungus that causes ""crown rust"" disease. To even the odds in the oat plant’s favor, the team resorted to a plant breeding strategy called “gene stacking” (or “pyramiding”). A key part of that strategy involved making a series of crosses between a cultivated oat variety and wild relatives, one known as lopsided oat, which carry genes for “adult plant resistance.” “Adult plant resistance, sometimes referred to as ‘slow rusting,’ provides the oat plant some immunity—but not complete immunity,” Kianian said. “In this case, the selection pressure on the pathogen to change is reduced, and the plant is not damaged much so that it can still produce and yield grain for the growers.” All told, the team stacked offspring plants derived from crosses with three genes for adult plant resistance to crown rust. They then subjected the offspring plants to a trial by fire, of sorts, starting in 2020. In essence, this involved growing them in nursery plots of common buckthorn, a secondary host for crown rust and known source of outbreaks. In the plots, under intense pressure from the disease, two lines of offspring plants consistently fared better than the others, namely, CDL-111 and CDL-167. The sturdy oat lines have since been propagated for their seed, which is available for use in variety development programs under a material transfer agreement with ARS, Kianian said. This is to ensure the effectiveness of the gene-stacking strategy if the oat lines are crossed with commercial varieties—regardless of whether they already possess seedling resistance to crown rust. By adhering to this requirement, plant breeders can arm elite oat varieties adapted to particular production regions with a one-two punch against the crown rust fungus—a “jab” via seedling resistance and a “right hook” with adult plant resistance. “For this, we are also providing molecular markers linked to the three genes that can be used in selecting the lines that carry them,” added Kianian, who collaborated with Eric Nazareno and Kevin Smith—both with the University of Minnesota—Melanie Caffe (South Dakota State University), Roger Caspers (ARS), Howard Rines (ARS, deceased) and Marty Carson (ARS, deceased). Carson started some of the oat work 20 years ago, continuing much of it after retirement, Kianian noted. The Agricultural Research Service is the U.S. Department of Agriculture's chief scientific in-house research agency. Daily, ARS focuses on solutions to agricultural problems affecting America. Each dollar invested in U.S. agricultural research results in $20 of economic impact. "
October 1 2024,https://www.ars.usda.gov/news-events/news/research-news/2024/targeted-grazing-a-successful-low-cost-method-to-manage-cheatgrass-when-timed-properly/,"Targeted Grazing, A Successful & Low-Cost Method to Manage Cheatgrass When Timed Properly",Maribel Alonso,Maribel.Alonso@usda.gov,"October 1, 2024 Targeted livestock grazing is a successful and cost-efficient method to manage cheatgrass in the U.S. western Great Plains when timed to coincide with cheatgrass growth rather than based solely on the time of year, according to a recent study published by USDA’s Agricultural Research Service (ARS) and the University of Nebraska–Lincoln (UNL). Findings show the targeted grazing window lasts approximately 38 days in the spring, with some variation depending on the year and location. Cheatgrass (Bromus tectorum) is an annual grass native to Eurasia that has become one of the most problematic invasive species in the western U.S. This invasive species outcompetes native vegetation in the spring, and after completing its growth, it dries into fine fuels during the summer, leading to more frequent, widespread wildfires. One low-cost method is known to help manage this problem. Early spring targeted grazing, where cattle are allowed to graze cheatgrass early in the season at the right time, can help limit seed production and reduce the competitiveness of cheatgrass. However, what is the right timing for this grazing method to be successful? ARS Research Ecologist Dana Blumenthal, one of the co-authors of the recently published paper, explains a key finding of the study, “Cattle are very predictable in when they like to eat cheatgrass. Producers can effectively graze it from when it’s four inches tall until it’s done flowering, and the seeds are hardening up. That is a window of about a month to a month and a half. The window moves around from year to year, so it’s important to use cheatgrass growth as a guide for when to graze rather than calendar dates.” Spring heifer grazing on cheatgrass. (Photo courtesy of Julie Kray, ARS.) Researchers at the ARS’ Rangeland Resources & Systems Research facility (with locations in Colorado and Wyoming) and the UNL’s Panhandle Research and Extension Center collected data from mixed-grass prairie sites in the western Great Plains, including Nebraska and Wyoming, over a period of four years. The scientists identified pastures with areas of cheatgrass intermixed with native plant communities and grazed them with yearling cattle from April through June. Samples of fecal material from the grazing cattle were collected twice a week and analyzed to determine the proportion of different grass species in their diets. Researchers measured vegetation phenology (height and flowering stage), forage quality, and biomass of cheatgrass and coexisting native plant species. These measurements helped them compare the differences in cattle selection for plant species and forage quality over the four years. “We were surprised by how late in the season the cattle kept using cheatgrass. That’s really helpful because it gives producers more time to get cattle out into cheatgrass areas and have an impact,” said Blumenthal. Results of this four-year study showed that grazing can be timed effectively by keeping track of two easily observable cheatgrass characteristics – height at the beginning of the grazing window and seed maturity later on. The resulting grazing windows, on average across the years of this study, were seven days longer in the western Nebraska site compared to the southeastern Wyoming site. In terms of impact, results showed that targeted grazing in the early spring can reduce seed production of cheatgrass by as much as 77 percent when compared to summer grazing. Furthermore, spring targeted grazing can lead to favorable cattle weight gains due to higher crude protein and energy in cattle diets during this period. “Moving forward, we’d like to learn in which years grazing has the largest effect on cheatgrass seed production. Is it when cattle eat more cheatgrass because the plants are larger, or when cheatgrass is already struggling to grow, for example, in a drought?” said Julie Kray, an Agricultural Science Research Technician with the Rangeland Resources & Systems Research facility. “We know that multiple years of targeted grazing will be needed to control cheatgrass, but there may be certain years in which it is more important to prioritize grazing it.” Visit “Targeted grazing to control cheatgrass in mixed-grass rangeland” for more details about this study. The Agricultural Research Service is the U.S. Department of Agriculture's chief scientific in-house research agency. Daily, ARS focuses on solutions to agricultural problems affecting America. Each dollar invested in U.S. agricultural research results in $20 of economic impact. "
