date,url,title,author,email_contact,content
April 2 2024,https://www.ars.usda.gov/news-events/news/research-news/2024/scientists-gain-insight-into-a-buzzing-spring-pollinator-that-plays-a-significant-role-in-the-almond-industry/,Scientists Gain Insight into a Buzzing Spring Pollinator that Plays a Significant Role in the Almond Industry,Maribel Alonso,Maribel.Alonso@usda.gov,"The USDA’s Agricultural Research Service (ARS), in collaboration with the Ecological Forestry Applications Research Centre in Spain and North Dakota State University, conducted a comparison of the physiological and molecular processes involved in the summer and winter dormancy of Osmia lignaria, also known as blue orchard bee or orchard mason bee. This analysis of gene expression is believed to be the first to compare the dormancy periods of this species in their natural habitat, and more importantly, it led to sequencing the first draft genome of this important pollinator for the almond industry. According to the U.S. Forest Service, North America has 140 species of Osmia. Osmia lignaria, a solitary bee, follows a one-year lifecycle that includes two periods of dormancy. During summer, the bee develops to the prepupal stage (the stage of larva after its final molt), pauses, then finishes to developing to the adult stage before winter. Adult bees slow their metabolic activity while overwintering [second dormancy]. When spring arrives, adult bees emerge from dormancy and become highly active in pollination. Although this species does not produce honey, it is very effective in pollinating almond trees due to cross-pollination among different varieties, which leads to higher crop yields. Osmia ribifloris is one of several relatives of the blue orchard bee (Osmia lignaria). These bees are effective pollinators for almond trees due to the way they cross-pollinate among different varieties, leading to higher crop yields. (Photo by Photo by Jack Dykinga) “This species inhabits a wide latitudinal range in North America, with populations in the north having different developmental rates and lengths of dormancy periods than those in southern populations,” said Alex Torson, a computational biologist with ARS’ Insect Genetics and Biochemistry Research in Fargo, North Dakota. “In the future, we can use the genome presented in this study to start comparing the genomes of individuals from these different geographic populations. If these differences in development and dormancy can be traced to their genetics, then we could develop managed populations from different geographic locations, and time the characteristics of those populations with peak floral blooms for different types of crops.”  By aligning their emergence with the timing of crops, it would allow for better management and pollination, as this bee species emerges in the spring and is a significant pollinator of almond trees due to how it pollinates. Understanding how this lifecycle occurs has become increasingly important due to changes in environmental conditions. A better understanding of the evolutionary relationships among populations of this species will be critical for developing managed populations we can use for pollination services. The study is available in Insect Biochemistry and Molecular Biology. The Agricultural Research Service is the U.S. Department of Agriculture's chief scientific in-house research agency. Daily, ARS focuses on solutions to agricultural problems affecting America. Each dollar invested in U.S. agricultural research results in $20 of economic impact. "
March 28 2024,https://www.ars.usda.gov/news-events/news/research-news/2024/usda-nueta-hidatsa-sahnish-college-collaborate-to-support-indigenous-seed-sovereignty-distribution-of-new-seeds-in-late-spring/,"USDA, Nueta Hidatsa Sahnish College Collaborate to Support Indigenous Seed Sovereignty Distribution of New Seeds in Late Spring",Maribel Alonso,Maribel.Alonso@usda.gov,"“As we celebrate our one-year anniversary, ARS is excited to announce that we have produced new seeds and seedlings of vital native crops which will be distributed to MHA Tribal members this spring via NHS College,” said Dr. Simon Liu, ARS Administrator. “Our partnership with NHS College enables us to gain a better understanding of the unique agricultural research needs of tribal communities. This achievement reflects ARS' ongoing commitment to integrating the needs and practices of Indigenous Traditional Ecological Knowledge into our research portfolio to support the priorities of tribal communities and indigenous agriculture.” ARS’ partnership with NHS College will improve seed health through multiplication, germination, and viability. It also includes data collection to determine the traditional use and characteristics of MHA Nation’s traditional varieties. This work is important for protecting seed intellectual property, providing data to support increased consumption, and demonstrating the link between traditional varieties and health while sharing cultural protocols and traditional ecological knowledge throughout the project. During the project’s first year, ARS researchers at the Northern Great Plains Research Laboratory (NGPRL) in Mandan, North Dakota, successfully grew a wide range of traditional crops necessary for seed and seedling distribution.  The yield included eight varieties of corn (totaling 28 gallons of corn seeds), seven varieties of squashes (totaling over 500 squashes), four varieties of beans (producing a half a gallon of seeds), and more than 150 of one variety of watermelon (over 150 watermelons) grown on half an acre.  Seed and seedlings of varieties of corn, squash beans, and watermelon [one variety]. (Photo courtesy of Dr. Ruth Plenty Sweetgrass-She Kills). The NHS College established a Project Advisory Team that includes representatives from each of the three Tribes. This team provides direction on strategies to increase the number of seeds, to determine seed distribution, to collect program data, and to integrate Traditional Ecological Knowledge within the project. “By reconnecting the Mandan, Hidatsa, and Arikara people with our traditional seeds, we are bringing life back into the relationship between our seeds, our people, and our land,” said Dr. Ruth Plenty Sweetgrass-She Kills, Director of NHS College's Food Sovereignty Program. “This act of seed sovereignty also strengthens our Tribal food system and provides access to nutrient-dense foods that our people’s DNA recognizes and remembers.” Since 1998, NHS College has stewarded MHA traditional varieties through its Four Sisters Garden. NHS College’s traditional seed cache was established and has been maintained through donations by Tribal members and scholars and the rematriation [retrieval] of seeds from various institutions. In 1953, the Garrison Dam flooded the fertile agricultural land on Fort Berthold and forced MHA Nation Tribal members to re-establish new homes and communities on infertile dryland. This has contributed to the loss of cultural identity of MHA Nation tribe members, including the growth and consumption of their traditional crops. “Seeds need to be regrown at least every ten years to remain viable, as the viability of seeds decreases by about 10 percent each year,” said Dr. Claire Friedrichsen, an NGPRL research social scientist. “ARS’ role is to increase the health of seeds within NHS College’s traditional seed cache. This includes ensuring seeds are free from disease or rot, have limited disease susceptibility, and are free from other detrimental developmental conditions. Maintaining the health of seeds is important for the ability of a collection to continuously adapt to climate, land, and culture to produce healthy crops.” For inquiries regarding the distribution of new seeds, donations of old seeds that need to be grown to maintain their viability, or to become a member of the Nueta Hidatsa Project Advisory Team, email Dr. Ruth Plenty Sweetgrass-She Kills at NHS College at rhall@nhsc.edu.

This USDA-funded is a pilot project to create a roadmap for other Tribal institutions to collaborate with USDA ARS to support indigenous seed sovereignty. The effort supports the USDA Indigenous Food Sovereignty Initiative announced by Secretary Tom Vilsack in 2022 (See, “USDA Announces New Resources to Empower Indigenous Food Sovereignty”). The Agricultural Research Service is the U.S. Department of Agriculture's chief scientific in-house research agency. Daily, ARS focuses on solutions to agricultural problems affecting America. Each dollar invested in U.S. agricultural research results in $20 of economic impact. "
March 27 2024,https://www.ars.usda.gov/news-events/news/research-news/2024/usda-completes-laboratory-modernization-to-advance-pecan-breeding-and-research/,USDA Completes Laboratory Modernization to Advance Pecan Breeding and Research,Maribel Alonso,Maribel.Alonso@usda.gov,"Pecan trees represent North America's native nut tree and a multimillion-dollar crop. These trees have been cultivated commercially for less than 150 years. It takes an average of 28 years from planting a new seedling to releasing a new pecan cultivar with traditional methods of pecan breeding. This is due to the long waiting period for pecan trees to start producing nuts, which takes up more than half of the time. With the new modernized laboratory, the Pecan Breeding and Genetics Program will now be able to incorporate genetic techniques into pecan breeding to accurately predict mature nut traits on young seedlings, saving up to a decade in the breeding process. Breeding new pecan cultivars is a lengthy process with long waiting periods of 7-10 years before a pecan tree can produce nuts and long testing phases to evaluate potential cultivars. It is challenging to support pecan breeding efforts due to their high resource demands and extended timelines, which make it impractical for private or commercial entities and challenging for academic programs. The event was hosted by USDA's ARS and the Texas Pecan Grower’s Association. ARS leaders, State Representatives, scientists, and members of the pecan industry organizations toured the new laboratory with now dedicated research spaces for plant genetics, microscopy, tissue culture, controlled-environment growth chambers, and plant disease research. ""Today marks the celebration of the opening of a new genetics and pathology laboratory,"" said Warren Chatwin, the Lead Scientist at the Pecan Breeding and Genetics Program in Somerville, Texas. ""This facility will enable ARS' researchers here at Somerville to advance pecan breeding and support modern genetics and plant disease research, which hasn't been possible since this site was established in the 1980s."" ""This event also highlights the significant impact of our stakeholders, the pecan industry organizations. They have unified their voice through the National Pecan Federation to express the need for increased quality, accuracy, and speed of pecan breeding, genetics, and plant disease research, leading to the establishment of this laboratory space. The success of our research is only possible through partnerships with stakeholders including the Texas Pecan Grower’s Association, which has provided decades of support and significant contributions, most recently through the National Pecan Federation,"" added Chatwin. The USDA Pecan Breeding and Genetics Program's new genetics and pathology laboratory meets biosafety containment standards and is equipped with modern research spaces that will advance pecan breeding, genetics, and plant disease studies. (Photos provided by Warren Chatwin, ARS). In addition, researchers will now be able to do controlled evaluations of promising breeding lines with different regional strains of pecan scab. Pecan scab, caused by the fungal pathogen Venturia effusa, is the most economically significant disease in the pecan industry and has high diversity across the geographic range of cultivated pecans. For the first time, the Pecan Breeding and Genetics Program will now be able to screen pecan scab cultures from all areas of the country in controlled environments to identify new sources of disease resistance and incorporate those unique samples into the breeding program. Researchers will also be able to do controlled evaluations for other significant and emerging pathogens of pecan, including the heavily quarantined international pathogen, Xylella fastidiosa. The Pecan Breeding and Genetics program has released 32 pecan cultivars to the industry, with notable releases like 'Pawnee,' which moved the commercial harvest window forward to mid-September, 'Lakota,' which has high scab resistance, and 'Wichita,' a high-yielding cultivar that performs well in the West. USDA-ARS’ most recently released cultivars include 'Pueblo,' 'Seneca,' and 'Zuni,' which were patented in 2022. The Agricultural Research Service is the U.S. Department of Agriculture's chief scientific in-house research agency. Daily, ARS focuses on solutions to agricultural problems affecting America. Each dollar invested in U.S. agricultural research results in $20 of economic impact. "
March 20 2024,https://www.ars.usda.gov/news-events/news/research-news/2024/scientists-collaborate-to-study-the-cause-and-development-of-liver-abscesses-in-cattle/,Scientists Collaborate to Study the Cause and Development of Liver Abscesses in Cattle,Maribel Alonso,Maribel.Alonso@usda.gov,"To effectively prevent liver abscesses in cattle, it is crucial to gain a complete understanding of the development of this condition and the bacteria responsible for causing the infection. A collaborative effort between scientists from the USDA’s Agricultural Research Service (ARS), Texas Tech University, Kansas State University, and West Texas A&M University work on reliable and repeatable liver abscess models to learn the triggers for this costly condition in cattle that not only negatively impacts animal well-being but also causes liver condemnations and may lead to increased carcass trimming and an overall decrease in profitability. The first successful model study, recently published in the Journal of Animal Science,  is part of a series of studies conducted at the USDA-ARS Livestock Issues Research Unit in Lubbock, Texas, that aim to find solutions to a problem of concern for animal well-being that is costing the industry millions of dollars. Cattle with liver abscesses can experience health problems and reduced growth and feed efficiency. However, cattle with liver abscesses don’t show clinical signs and are generally identified too late –at harvest. The economic losses associated with this condition in cattle can be as high as 400 million dollars annually. The knowledge gained from these models will help develop preventive interventions. ""After decades of studies, researchers haven't found an accurate way to predict nor diagnose liver abscesses, because of the complexity of the disease,"" said Rand Broadway, a research scientist with the Livestock Issues Research Unit. ""Our study is a huge collaborative effort between USDA and academic partners to develop a liver abscess model in cattle that can help us better understand how liver abscess formation begins. We are constantly learning about the causes and development of these abscesses.""  This model consistently showed a 50 percent prevalence, which is important for researchers to study liver abscess development and prevention strategies, particularly in calves entering the beef supply chain from dairy origin. In addition, the model continues to be improved in an effort to mimic “real-world” disease etiology while examining the physiological changes in the animal to better understand root causes of the disease.   Currently, the primary treatment to prevent liver abscesses in cattle has been in-feed antibiotics. However, antibiotics have come under more scrutiny by the general public, and alternatives to antibiotics are being sought. ""We are trying to ensure this model is effective and applicable to test non-antibiotic interventions in the future,"" added Broadway. ""We seek to use the knowledge gained from these models to develop different alternative interventions, such as nutrition management strategies."" In the study, scientists work with dairy and ‘beef-dairy’ cross steers, the population of cattle that most commonly suffer from this infection. They tested two diets (a high grain-based and forage-based) and three bacteria commonly found in liver abscesses [Fusobacterium necrophorum subsp. necrophorum, Trueperella pyogenes, and Salmonella enterica serovar Lubbock]. The results from the high-grain diet model were found to be more reliable, leading scientists to focus more on this model. Most people associate liver abscesses in cattle with a high-energy diet. The theory is that when cattle are fed elevated grain levels, highly fermentable starch in the rumen is rapidly fermented by bacteria, causing a drop in rumen pH. This acidity causes damage to the rumen lining, allowing bacteria to travel into the blood, reaching the liver and other organs where they can cause infection. However, it is still unknown with accuracy the exact route that these bacteria take to cause infection or injury to the liver. Scientists discovered that the bacteria associated with liver abscesses in cattle may not always originate from the rumen. An alternative route may be bacterial travel from the lower gastrointestinal tract. The research showed that in some cases, when these bacteria were not detected in the acidic rumen environment caused by a high-grain diet, no liver abscesses were detected. However, when scientists introduced bacteria directly to the rumen, they observed the formation of liver abscesses and were able to isolate the bacteria from the infected sites. The study confirms that an acidotic diet, combined with bacterial inoculation in the rumen, can be used as a model to induce liver abscesses. However, further research is being conducted at USDA to determine the consistency of the model before it can be used to evaluate new interventions to prevent this complex infection. The Agricultural Research Service is the U.S. Department of Agriculture's chief scientific in-house research agency. Daily, ARS focuses on solutions to agricultural problems affecting America. Each dollar invested in U.S. agricultural research results in $20 of economic impact. "
March 19 2024,https://www.ars.usda.gov/news-events/news/research-news/2024/usda-researchers-use-an-edible-blue-green-algae-to-protect-honey-bees-against-viruses/,USDA Researchers Use an Edible Blue-Green Algae to Protect Honey Bees Against Viruses,Jessica Ryan,Jessica.Ryan@usda.gov,"Honey bees are important agricultural pollinators. However, viruses, including DWV, are linked to the deaths of millions of colonies worldwide. DWV, like other viruses, is most often spread by Varroa mites who carry the disease inside them and infect bee colonies. Infection typically causes deformity and death in bees, especially in the pupae and brood. These colony losses devastate beekeeping industries and pose a major risk to agriculture and the global food supply. While there are medicines for other bee diseases and parasites, there is currently no treatment available to help beekeepers reduce viruses in their colonies. Nearly all colonies have DWV and can often be infected with multiple viruses at any given time. Effective antiviral treatments could help to improve colony health and survival as well as crop pollination efficiency. ""We found that engineered algae diets suppressed DWV infection and improved survival in honey bees,"" said Vincent Ricigliano, research scientist at the ARS Honey Bee Laboratory in Baton Rouge, Louisiana. ""When mixed into bee food, the engineered algae boost the bee’s immune system to fight off the targeted virus."" Honey bees feed on a pollen patty containing microalgae. (Photo by Vincent Ricigliano, ARS) According to Ricigliano, blue-green algae is the ""bee’s knees"" of bee food additives. Ricigliano and other ARS researchers previously studied blue-green microscopic algae, also known as microalgae, as a potential food source for honey bees. The algae showed promise since it has a nutritional profile that resembles pollen and is scalable to the level of commercial beekeeping. ""In addition to the nutritional benefits and immune-boosting effects, engineered algae strains have the potential to protect bees against a wide variety of pathogens,"" said Ricigliano. Blue-green algae grow via photosynthesis and can remove carbon dioxide from the atmosphere, making it an ecologically friendly approach to improve the health of honey bees. ""This technology represents a potential new class of treatments for honey bees that is highly sustainable and scalable,"" said Ricigliano. ""It can be added directly to supplemental feed without additional processing and easily integrated into beekeepers’ existing management practices. However, there are regulatory considerations that must be addressed before these applications can be fully realized."" The researchers filed a patent application for the technology and plan to use variations of it to target additional bee viruses and other pathogens in future studies. The Agricultural Research Service is the U.S. Department of Agriculture's chief scientific in-house research agency. Daily, ARS focuses on solutions to agricultural problems affecting America. Each dollar invested in U.S. agricultural research results in $20 of economic impact. "
