date,url,title,author,email_contact,content
May 13 2024,https://www.ars.usda.gov/news-events/news/research-news/2024/no-love-for-mealybug-menace-of-vineyards/,No Love for Mealybug Menace of Vineyards,Jan Suszkiw,Jan.Suszkiw@usda.gov,"Fake pheromones offer a way to foil the love lives of vine mealybugs and keep populations of these prolific, soft-bodied insect pests from reaching damaging levels in vineyards of wine, raisin and table grapes. Producing large amounts of the chemical insect sex attractants for release into the air to prevent lovelorn male mealybugs from finding females to mate with can be difficult and expensive. Now, however, clues to less costly synthetic pheromone alternatives are emerging from Agricultural Research Service (ARS) scientists’ studies of the pest’s olfactory system. Keeping vine mealybugs from meeting and mating is a big deal, considering they can produce multiple generations over the growing season. Unchecked, the pests suck sap from the grape plants, weakening them and reducing their fruit yields and quality. They also secrete honey dew, a waste that can drop onto grape clusters and promote the growth of black sooty mold—both of which can diminish the fruit’s marketability. Adding insult to injury, and perhaps most importantly, the pests also transmit a group of viruses that cause grape leafroll diseases. The presence of these viruses can necessitate the destruction of entire vineyards when infection rates hit 25 percent or higher. Using a genomic map of the vine mealybug together with sophisticated analytical procedures, the scientists discovered two key olfactory receptors (from among 50 total) that alert male mealybugs that love is in the air in the form of lavandulyl senecioate, the sole chemical constituent in a female’s pheromone. ARS scientists examine new ways to foil love lives of costly vineyard pest. (Photo by Jessica Griffiths, D3881-1) The receptors are so specific that no other known chemical odorant found in nature will prompt the males to take flight in search of females to mate with, noted Jacob Corcoran, an entomologist with the ARS Biological Control of Insects Research Laboratory in Columbia, Missouri. To confirm this specificity, Corcoran and colleague plant pathologist Walter Mahaffee at the ARS Horticultural Crops Disease and Pest Management Research Unit in Corvallis, Oregon, used a specialized cell line cultured in the lab to express (examine the function of) two of the vine mealybug’s olfactory receptors. Next, they exposed the cells to various doses of lavandulyl senecioate. This triggered the activation of cell signaling pathways indicating the receptors’ detection of the pheromone. The cells were also exposed to grapevine odors that the mealybugs normally find attractive in nature. However, no signaling pathways were activated, confirming the two receptors were highly specific to the sex pheromone compounds. With this method, the scientists have begun contemplating more diabolic ways to mess with the pest’s love life. On the one front, they envision using the method to screen for molecules called antagonists that could be used to deactivate the pest’s olfactory receptors in nature, preventing their detection of pheromone and dooming male vine mealybugs to a sad, lonely life of buggy bachelorhood. Or, in the reverse, proteins called agonists could be formulated to put the receptors in “overdrive,” compelling males to chase phantom pheromone signals where none exist. On yet another front, the researchers are pursuing the use of the olfactory receptors in biosensors—pheromone-sniffing devices that can be deployed throughout a vineyard to alert growers to where and when the pest’s numbers are on the rise so countermeasures can be timed accordingly. As the scientists see it, the use of pheromone-based tactics like mating disruption is part of a multi-pronged fight against the mealybug that includes the application of insecticides, organically compatible products like natural oils and biological or cultural control methods. Details on their latest advances on the anti-olfactory front against the pest were reported in the January 2024 issue of Current Research in Insect Science. The Agricultural Research Service is the U.S. Department of Agriculture's chief scientific in-house research agency. Daily, ARS focuses on solutions to agricultural problems affecting America. Each dollar invested in U.S. agricultural research results in $20 of economic impact. "
May 7 2024,https://www.ars.usda.gov/news-events/news/research-news/2024/usda-ars-innovators-honored-as-finalists-of-samuel-j-heyman-service-to-america-medals-for-transformative-contributions-to-science-and-agriculture/,USDA-ARS Innovators Honored as Finalists of Samuel J. Heyman Service to America Medals for Transformative Contributions to Science and Agriculture,Katharina Hirschi,Katharina.Hirschi@usda.gov,"Research Leader Yan Ping (Judy) Chen and Research Entomologist Jay Evans, both of the Beltsville Agricultural Research Center Bee Research Laboratory in Beltsville, Maryland, are recognized for their transformative efforts in revolutionizing bee disease diagnosis and treatment. Tara McHugh, Pacific West Area Director in Albany, California, is also recognized for her visionary leadership and pioneering contributions to the development of novel healthy processed food products. The Samuel J. Heyman Service to America Medals, widely known as the ""Sammies,"" honors federal employees who make significant contributions to the well-being of the American people through their exemplary service and visionary leadership. ""The achievements of these scientists represent the pinnacle of excellence in scientific research and public service,"" said Agricultural Research Service Administrator Simon Liu. ""Their unwavering commitment to innovation and their profound impact on society underscore the vital role of federal employees in advancing the well-being of the American people."" Left: Research leader Yan Ping (Judy) Chen conducts a field inspection. (Photo by Michele Hamilton, ARS) Right: Research entomologist Jay Evans holds a honeycomb. (Photo by Maria McCarthy, Hawaii Department of Agriculture) Chen and Evans have been instrumental in harnessing cutting-edge molecular and genomic technologies to combat the decline of honeybee populations. Their collaborative research addresses critical threats such as parasite infestation, habitat loss, pesticide exposure, and pathogen evolution–bolstering bee health and safeguarding agricultural ecosystems vital to global food security. Self-described as ""bee doctors,"" the duo have pioneered novel treatments for bee ailments to combat antibiotic resistance and have developed solutions to neutralize pesticide exposure. ARS Pacific West Area Director Tara McHugh poses with some of the many products researched and developed by her team in the ARS Healthy Processed Foods Research Unit in Albany, California. (Photo by Stephen Ausmus, ARS) Tara McHugh has spearheaded initiatives to develop nutritious, shelf-stable food products that mitigate food waste, improve nutrition, and foster economic growth in underserved communities. Her tireless advocacy for innovation and entrepreneurship has catalyzed the creation of new companies, generating employment opportunities and advancing agricultural research across diverse scientific domains. McHugh's partnerships with entrepreneurs and innovators have facilitated the development of nutritious snacks, including a crunchy oat snack for children and a healthy protein and fiber-rich new food ingredient powder derived from brewers spent grains. Her visionary leadership and scientific acumen created a shift in the food industry, offering solutions to combat food waste and enhance public health. The recognition of Chen, Evans and McHugh demonstrates the dedication and ingenuity of USDA-ARS scientists in addressing pressing challenges and advancing the frontiers of science, technology and agriculture. Since its inception in 2002, the Sammies have honored over 700 outstanding federal employees. All finalists are eligible for the Service to America Medals People’s Choice Award. You can support ARS scientists by voting for Chen, Evans and McHugh online starting today. The Agricultural Research Service is the U.S. Department of Agriculture's chief scientific in-house research agency. Daily, ARS focuses on solutions to agricultural problems affecting America. Each dollar invested in U.S. agricultural research results in $20 of economic impact. "
May 6 2024,https://www.ars.usda.gov/news-events/news/research-news/2024/usda-university-of-nebraska-lincoln-nebraska-innovation-campus-break-ground-for-new-research-center-on-precision-agriculture/,"USDA, University of Nebraska-Lincoln, Nebraska Innovation Campus Break Ground for New Research Center on Precision Agriculture",Maribel Alonso,Maribel.Alonso@usda.gov,"“There is a long history of scientific innovation and collaboration between ARS and UNL, typical of the USDA – Land-grant University partnerships across the country,” said Dr. Chavonda Jacobs-Young, USDA Chief Scientist and Under Secretary for Research, Education, and Economics. “Updated facilities ensure our best and brightest scientists work in the environment and with the tools they need to successfully meet the challenges agriculture faces.” Federal, state and university leaders launched construction of the USDA's National Center for Resilient and Regenerative Precision Agriculture with a May 6 groundbreaking at Nebraska Innovation Campus. Pictured (from left) is Chris Kabourek, interim president of the University of Nebraska; Rodney D. Bennett, chancellor, University of Nebraska–Lincoln; U.S. Senator Pete Ricketts; U.S. Representative Mike Flood; Nebraska Governor Jim Pillen; Chavonda Jacobs-Young, under secretary for research, education and economics and chief scientist for the USDA; U.S. Senator Deb Fischer; Paul Kenney, University of Nebraska regent; U.S. Representative Don Bacon; Jack Stark, University of Nebraska regent; Simon Liu, USDA-ARS administrator; and Mike Boehem, vice chancellor for UNL’s Institute of Agriculture and Natural Resources. (Photo by Craig Chandler, UNL University Communication and Marketing) During this digital era, agricultural production and agricultural landscapes are transforming. Farmers and producers need the latest information technology, tools, and data to make informed and innovative decisions for their unique operations. The Center will focus on key research areas to address these challenges and promote sustainable, resilient, and highly efficient agriculture practices. “This project is a testament to the long history of innovation, ingenuity, and adaptability of agricultural producers across the United States and right here in Nebraska. It celebrates an incredibly productive 120-year partnership between USDA-ARS and the University of Nebraska–Lincoln, and it exemplifies the passion and dedication of agricultural, state, and federal leaders,” said Mike Boehm, NU Vice President and Harlan Vice Chancellor for UNL’s Institute of Agriculture and Natural Resources. “Nebraska is a special place with incredible people, and the ripples of what we do here often extend around the globe. I believe the work that will take place in this facility will usher in a new era of American agriculture, and I’m thrilled that what happens next in agriculture will happen first in Nebraska.” Construction will start with state-of-the-art greenhouses that will allow ARS to perform research on wheat, barley, sorghum, forage and bioenergy grasses and other crops. Research on how these plants respond to emerging pests and pathogens under a full-range of environmental conditions will empower scientists to make cutting-edge discoveries with the goal of developing climate-resilient crops for the U.S. agriculture industry. Image synthesis (top view) of the fully completed USDA ARS National Center for Resilient & Regenerative Precision Agriculture, including state-of-the-art greenhouses for crop, forage, and bioenergy grasses research. (Image courtesy of HDR). Once fully completed, the 120,000-square-foot agriculture research complex will function as a central hub for multidisciplinary experts, scientists and engineers who will collaborate with industry and producers to improve water and food security, increase the resilience of agricultural landscapes, and enhance agricultural profitability. The establishment of the National Center for Resilient and Regenerative Precision Agriculture will further strengthen the long-lasting collaboration over the past century between ARS and UNL. These partnerships are instrumental in advancing research on sustainable bioenergy crops and production systems in an age where agriculture is expected to supply 40 percent of U.S. liquid fuels within the next three decades, in addition to providing food and fiber to the nation’s growing population. The Wheat, Sorghum and Forage Research Unit and the Agroecosystem Management Research Unit are currently located on UNL’s campus. The scientists working at these units are making significant contributions to crop and livestock production systems by improving productivity, stability of production, sustainability, and profitability. Other leaders who provided remarks during the groundbreaking ceremony included: The Agricultural Research Service is the U.S. Department of Agriculture's chief scientific in-house research agency. Daily, ARS focuses on solutions to agricultural problems affecting America. Each dollar invested in U.S. agricultural research results in $20 of economic impact. "
April 25 2024,https://www.ars.usda.gov/news-events/news/research-news/2024/usda-ars-inducts-veterinary-medicine-expert-into-hall-of-fame/,USDA-ARS Inducts Veterinary Medicine Expert into Hall of Fame,Jessica Ryan,Jessica.Ryan@usda.gov,"ARS established the Hall of Fame program in 1986 to honor senior agency researchers for outstanding, lifelong achievements in agricultural science and technology. Nominees must be retired or eligible to retire to receive the award. ""Dr. Suarez is being recognized for his dedication and exemplary work that has had significant impact on the agricultural sector and general public through his innovative approaches to problem-solving,"" said ARS Administrator Simon Liu. ""He exemplifies the values that have made ARS the premier agricultural research organization it is today."" David Suarez Suarez played key roles in responding to outbreaks of avian influenza, Newcastle disease and other emerging pathogens. He helped characterize viruses to provide information to state and federal partners to help control these diseases. His most impactful work was developing and supporting the implementation of rapid molecular diagnostic tests for the avian influenza virus and Newcastle disease virus that changed the way these diseases were diagnosed in the U.S. and worldwide. The tests developed were sensitive, specific, and rapid. This allowed for effective use in veterinary diagnostic laboratories responding to disease outbreaks. The tests became a cornerstone of eradication efforts by providing fast and scalable testing. The tests produced in Suarez’s laboratory were the first assays adopted by the National Animal Health Laboratory Network and have been used millions of times both in the U.S. and internationally. In efforts to control or eradicate avian influenza, veterinary medical officer David Suarez provides expertise and guidance to several Southeast Asian and eastern European countries to set up practical and effective laboratory systems. (Photo by Peggy Greb, ARS) Suarez also prioritizes mentoring the new generation of researchers. He served as a major professor for three Ph.D. students at the University of Georgia and has been the major professor for two master’s degree students (one at the University of Georgia and one at Tuskegee University). He also works with both universities in providing summer research internships to veterinary students. Suarez has also been recognized by federal agencies and industry organizations for his scientific advancements. Industry awards include the American Veterinary Medical Association Public Service Award (2016) and United States Animal Health Association Federal Partnership Award (2023). The Agricultural Research Service is the U.S. Department of Agriculture's chief scientific in-house research agency. Daily, ARS focuses on solutions to agricultural problems affecting America. Each dollar invested in U.S. agricultural research results in $20 of economic impact. "
April 18 2024,https://www.ars.usda.gov/news-events/news/research-news/2024/usda-scientists-honored-as-aaas-fellows/,USDA Scientists Honored as AAAS Fellows,Jan Suszkiw,Jan.Suszkiw@usda.gov,"Dr. Martin Williams, an ARS research ecologist, and Dr. Jay D. Evans, an ARS research entomologist, were named Fellows in a vote by the AAAS Council in recognition of their scientific contributions and leadership in the organization’s “Agriculture, Food and Renewable Resources” section. AAAS has awarded the Fellows distinction since 1874. Past honorees include inventor Thomas Edison, anthropologist Margaret Meade and current USDA Under Secretary and Chief Scientist Chavonda Jacobs-Young among others. Along with other new AAAS Fellows, Dr. Williams and Dr. Evans will be recognized at a Sept. 21 Fellows forum at the 2023 AAAS Annual Meeting in Washington, DC. “We’re immensely proud of these two very deserving scientists,” said ARS Administrator Dr. Simon Liu. “Their recognition by the American Association for the Advancement of Science is a testament to the scientific excellence they’ve demonstrated in tackling critical agricultural challenges, including helping farmers manage weeds in the face of climate change and keeping honey bees—our crops’ top pollinators—healthy and safe.” ARS research ecologist Martin Williams is a 2023 Fellow of the American Association for the Advancement of Science. (Photo by Martin Williams, ARS) Dr. Williams works in the ARS Global Change and Photosynthesis Research Unit in Urbana, Illinois, and was recognized for his distinguished contributions in the fields of weed science and vegetable crop production, as well as his service to those communities. Dr. Williams’ laboratory is co-located at the University of Illinois Champaign-Urbana, where he holds an adjunct faculty appointment, mentors graduate students, and co-teaches a graduate-level course on crop production. He has a well-documented, internationally renowned reputation for elucidating critical problems in crop production and delivering solutions to the vegetable seed and food processing industries in the U.S. and beyond. He led the team behind several significant contributions to the improvement of edamame, snap bean and sweet corn. His team pioneered novel methodology—using widely collected, but underused herbicide evaluation records—to help address the dual threats of weeds and climate change on grain crops. Dr. Williams earned a Ph.D. in agronomy at the University of Nebraska-Lincoln. He is also active in such professional organizations as the Weed Science Society of America and the International Sweet Corn Development Association. ARS entomologist Jay D. Evans is a 2023 Fellow of the American Association for the Advancement of Science. (Photo by Jay Evans, ARS) Dr. Evans is a lead scientist in ARS’s Bee Research Laboratory in Beltsville, Maryland, and was recognized for distinguished contributions to the fields of arthropod genomics, social insect biology, pollinator health and insect pathology—particularly studies of honey bee immunity and pathogens. Dr. Evans joined the ARS Beltsville Bee Lab in 1999, first as a research entomologist, and later serving as its research leader for seven years. Throughout, his research has focused on improving bee health in the face of diseases such as chalkbrood and parasitic mites, as well as developing new pest management tools. He was also a leader in the Honey Bee Genome Project and helped develop new genetic tools for bee breeding and disease diagnostics, as well as investigate safe medicines for bees. He has mentored dozens of students, promoted greater awareness of bee health and served the USDA and bee industry in various capacities. He is the recipient of ARS Early Career (2003) and Senior Scientist (2023) awards, among others. Dr. Evans earned a bachelor's degree from Princeton University and a Ph.D. in genetics and behavior from the University of Utah. The Agricultural Research Service is the U.S. Department of Agriculture's chief scientific in-house research agency. Daily, ARS focuses on solutions to agricultural problems affecting America. Each dollar invested in U.S. agricultural research results in $20 of economic impact. "
April 9 2024,https://www.ars.usda.gov/news-events/news/research-news/2024/finding-the-silver-lining-in-cotton-gin-waste/,Finding the “Silver Lining” in Cotton Gin Waste,Jessica Ryan,Jessica.Ryan@usda.gov,"Cotton gin waste, also known as cotton gin trash, is a byproduct of the cotton ginning process and occurs when the cotton fibers are separated from the seed boll. For cotton gin waste, the treasure is its hidden potential to transform silver ions into silver nanoparticles and create a new hybrid material that could be used to add antimicrobial properties to consumer products, like aerogels, packaging, or composites. Silver nanoparticles are highly sought-after products in the nanotechnology industry because of their antibacterial, antifungal, antiviral, electrical, and optical properties. These nanoparticles have an estimated global production of 500 tons per year and are widely applied to consumer goods such as textiles, coatings, paints, pigments, electronics, optics, and packaging. Cotton gin waste. (Photo by Sunghyun Nam) In a study published in ACS Omega, researchers from the United States Department of Agriculture (USDA)’s Agricultural Research Service (ARS) revealed the ability of cotton gin waste to synthesize and generate silver nanoparticles in the presence of silver ions. “Our method not only lets cotton gin waste act as chemical agents for producing silver nanoparticles, which makes it cost-effective and environmentally friendly but also enables embedding the nanoparticles within the cotton gin waste matrix,” said Sunghyun Nam, research engineer at ARS's Cotton Chemistry and Utilization Research Unit in New Orleans. “By embedding them in the cotton gin waste, these materials acquire antimicrobial properties.” Nam said the researchers used a simple heat treatment of cotton gin waste materials in water containing silver ions that produced silver nanoparticles without the need for additional chemical agents. Jacobs Jordan (left) shows a sample after nanoparticle synthesis, Sunghyun Nam (center) takes scanning electron microscope (SEM) images of cotton gin waste nanocomposites, and Michael Easson (right) shows cotton gin waste. (Photo by Michael Santiago Cintrón) This finding is significant since making silver nanoparticles usually requires chemical agents which can be costly and pose environmental concerns. Embedding nanoparticles into a material can also be challenging. Developing nanoparticle embedding technology is not new for Nam and her team. They previously developed washable antimicrobial wipes by using raw cotton fiber that produced silver nanoparticles inside the fiber. The embedded silver nanoparticles can continue to kill harmful bacteria wash after wash.  Large quantities of cotton gin waste are generated annually, and the cotton ginning industry is always seeking new sustainable processes that upcycle crop residue. “Our research paves the way for new material applications of cotton gin waste that can protect against microbial contamination,” said Nam. A provisional patent application on the self-embedding silver nanoparticle biomass waste compositions has recently been filed. The Agricultural Research Service is the U.S. Department of Agriculture's chief scientific in-house research agency. Daily, ARS focuses on solutions to agricultural problems affecting America. Each dollar invested in U.S. agricultural research results in $20 of economic impact. "
