date,url,title,author,email_contact,content
August 13 2024,https://www.ars.usda.gov/news-events/news/research-news/2024/scientists-developed-a-unique-approach-to-conserve-the-monarch-butterfly/,Scientists Developed a Unique Approach to Conserve the Monarch Butterfly,Author not found,Email not found,"Contact: Maribel Alonso
Email: Maribel.Alonso@usda.gov August 13, 2024 The monarch butterfly (Danaus plexippus L.) is one of the most widely popular butterfly species in North America. We are accustomed to seeing its beautiful orange wings with black-veined outlines flying in gardens and wildflower fields during the summer season.  Can you envision the summers without the monarch butterfly? Imagine the impact on the flora and ecosystem diversity of North America if this iconic species became extinct. To ensure this imaginative but plausible scenario can be preventable, USDA scientists at the Agricultural Research Service (ARS) Weed and Insect Biology Research Unit, in Fargo, North Dakota, developed the first known cryopreservation protocol for the successful long-term storage of monarch butterfly germplasm, specifically for preserving germ cells (spermatozoa or sperm cells). More importantly, the technique used in this protocol allows for the preserved samples to remain viable and highly intact post-cryopreservation. “An important aspect of insect conservation is habitat conservation. Our research is a new approach to conservation through germplasm cryopreservation,” explained Courtney Grula, a scientist at the Weed and Insect Biology Research Unit. “This study is the first to implement a technique to extract semen from the male reproductive tract in insects, a common technique used in mammals.” The viable sperm cells can one day be used with artificial insemination to bring back this species of butterflies in the event of a population loss. Although more studies are needed to develop an artificial insemination protocol using cryopreserved sperm cells from male butterflies, the study shows that this protocol is a viable method for germplasm conservation in this and similar species. Furthermore, ARS researchers in Fargo are assessing artificial insemination techniques for female butterflies using cryopreserved sperm cells from male butterflies. The monarch butterfly. USDA scientists are collaborating with stakeholders to preserve this iconic butterfly species in North America. (Photo courtesy of Getty Images) The monarch butterfly population was classified as an endangered species in North America by The International Union for Conservation of Nature. This was due to a rapid population decline that was observed from 1996 to 2014, followed by its stabilization over the past decade. Even though the current numbers are at a level of least concern, the decreasing trend has not stopped. Estimating the exact numbers is challenging due to their breeding and migratory behavior, as the monarch butterfly migrates every year long distances in a multi-generational migration that extends from Mexico to Canada. Like other pollinator species, the monarch butterfly's survival is threatened by climate change, the loss of native plants – milkweeds – and the rapid disappearance of their habitats. Scientists are collaborating with stakeholders to protect this species, including teaching the cryopreservation technique to researchers and breeders at the San Diego Zoo. In addition, they are working on extending the cryopreservation technique to cryopreserve spermatozoa from other endangered species, such as the Sacramento checkerspot butterfly, which is endemic to New Mexico. Grula, Research Biologist Arun Rajamohan, and Research Leader Joseph (Joe) P. Rinehart describe the technique in a study recently published in Scientific Reports.  “For people who are interested in helping monarch populations, they can plant common milkweed [Asclepias syriaca] in their yard, as this is utilized by monarchs for egg laying and larval diet,” added Grula. Learn about USDA’s efforts to conserve monarch butterflies’ habitats: The Agricultural Research Service is the U.S. Department of Agriculture's chief scientific in-house research agency. Daily, ARS focuses on solutions to agricultural problems affecting America. Each dollar invested in U.S. agricultural research results in $20 of economic impact. "
August 5 2024,https://www.ars.usda.gov/news-events/news/research-news/2024/ars-scientists-discover-strategically-applied-livestock-grazing-can-benefit-sagebrush-communities/,ARS Scientists Discover Strategically Applied Livestock Grazing Can Benefit Sagebrush Communities,Amaani Lyle,Amaani.Lyle@usda.gov,"While a cow grazing in a field isn’t typically remarkable, United States Department of Agriculture scientists have identified potential ecological benefits of strategically applied livestock grazing in sagebrush communities across U.S. western rangelands. As recently published in the scientific journal Ecosphere, the collaborative research effort among Agricultural Research Service (ARS) rangeland scientists at Burns, Oregon, and Fort Collins, Colorado, challenged the outdated dogma that livestock grazing in the sagebrush steppe always negatively impacts these ecosystems and, in fact, can convey desirable outcomes, particularly in regard to limiting both wildfire risk and invasive annual grasses. In addressing these ecological challenges, ARS scientists discovered that strategically applying livestock grazing prior to the occurrence of climate-induced wildfires can modify sagebrush steppe characteristics in ways that decrease fire probability and severity in the communities, promote biodiversity while reducing postfire annual grass invasion, fire-induced loss of native bunchgrasses, and fire damage to soil biocrusts, the collection of bacteria, fungi and mosses on the soil surface. Cow grazing a sagebrush community with low levels of invasive annual grass invasion during the growing season in eastern Oregon. (Photo courtesy of Kirk Davies) The ARS team compared moderately grazed and ungrazed sagebrush steppe and observed the grazing induced shorter flame lengths, slower rates of fire spread, and smaller burning fronts. Similarly, strategic grazing in annual grass-dominated rangelands reduced flame length and rate of spread — modifications that resulted in safer and more effective fire suppression. Still another benefit of modified fire characteristics, the scientists reported, is a decrease in the area burned and overall mosaic of burned and unburned patches. Grazing by non-native livestock such as sheep, cattle and horses dates back to the mid-to-late 1800s by Europeans, these early practices were not ecologically sustainable and led to widespread overuse and degradation to include loss of perennial grasses and forbs, reduced biodiversity, erosion, overabundant unpalatable species, and non-native plant invasions. Fuel break created with strategically applied grazing in an invasive annual grass-dominated sagebrush steppe in southeastern Oregon. (Photo courtesy of Kirk Davies) “There were concerns about the negative consequences of non-native livestock grazing in sagebrush communities, especially since these communities are experiencing unpreceded threats from invasive annual grasses, altered fire regimes, and climate change,” said Kirk Davies, ARS rangeland scientist. “But strategically applied grazing can spur desirable social-ecological outcomes such as reduced non-native annual grass invasion, decreased wildfire probability and spread, reduced fire suppression cost, and prevent undesirable ecological transformation post-fire.” Davies’ findings also indicated that grazing can modify competitive relationships in introduced bunchgrass seeding to favor native species recruitment. This can be particularly valuable for reestablishing sagebrush, a critical shrub for many native wildlife species. With careful attention to the timing, duration, frequency, and intensity of use needed to meet vegetation objectives, strategic grazing has the potential to reduce the detrimental impacts of invasive annual grasses, promote native species in introduced grasslands, and encourage native shrub recovery. “Recognizing livestock grazing as a tool that can achieve desired outcomes could improve our ability to achieve meaningful rangeland management outcomes in sagebrush and likely other rangeland communities,” Davies said. The Agricultural Research Service is the U.S. Department of Agriculture's chief scientific in-house research agency. Daily, ARS focuses on solutions to agricultural problems affecting America. Each dollar invested in U.S. agricultural research results in $20 of economic impact. "
August 2 2024,https://www.ars.usda.gov/news-events/news/research-news/2024/usda-research-documents-absence-of-trichinella-infection-in-commercial-pigs/,USDA Research Documents Absence of Trichinella Infection in Commercial Pigs,Autumn Canaday,Email not found,"The United States does not perform post-slaughter testing for Trichinella in the pork supply. While modern production systems followed by U.S pork producers effectively minimize risk of exposure to this parasite, absence of Trichinella infection has never been verified through national testing. ARS researchers pursued this study to ascertain whether the PQA+ program eliminates the risk of Trichinella exposure in commercial pork, thereby addressing the demands of the U.S. export market. The U.S. Pork Quality Assurance Plus (PQA+) program is an education and certification program designed by the U.S. pork industry to help pig farmers and their employees continually improve production practices. The program addresses food safety, animal well-being, environmental stewardship, worker safety, and public health. Many of the provisions for mitigating risk of Trichinella exposure are based on research conducted by ARS scientists. PQA+ includes five best management practices for prevention of exposure to Trichinella: In the ARS study, a total of 3,208,643 animals across twelve processing locations were tested over a period of 54 months. Parasites were not detected in any of the diagnostic samples, providing a 95% confidence in a Trichinella prevalence of less than 1 in 1,000,000 pigs. The occurrence of Trichinella in pork once posed a major food safety risk in many countries, justifying decades of effort expended on controlling this parasite. The data obtained from testing support the conclusion that pork from pigs managed under the PQA+ program do not pose a public health risk. “The surveillance data support the assertion that the U.S. PQA+ program effectively mitigates risk for Trichinella infection in pigs,” said Dr. Benjamin Rosenthal, Research Leader of the ARS Animal Parasitic Disease Laboratory. “It is equally important to note that the data could be useful for future food safety decisions, including hazard analysis decisions.” PQA+ guidelines and implementation details follow those for controlled management described by the World Organization for Animal Health and guidelines of the International Commission on Trichinellosis. Eleven U.S. pork processing companies, including 30 locations in 12 states, participated in the survey. There are currently more than 63,000 U.S. pork producers certified under PQA+. This research, which is highlighted in this month’s issue of Food and Waterborne Parasitology, was supported by funding from the Animal and Plant Health Inspection Service, Agricultural Research Service, and the U.S. National Pork Producers Council. The Agricultural Research Service is the U.S. Department of Agriculture's chief scientific in-house research agency. Daily, ARS focuses on solutions to agricultural problems affecting America. Each dollar invested in U.S. agricultural research results in $20 of economic impact. "
July 16 2024,https://www.ars.usda.gov/news-events/news/research-news/2024/a-high-quality-pectin-that-gels-with-low-sugar-products/,A High-Quality Pectin That “Gels With” Low Sugar Products,Jessica Ryan,Jessica.Ryan@usda.gov,"U.S. Department of Agriculture (USDA)’s Agricultural Research Service (ARS) scientists developed a high quality and inexpensive pectin that can successfully gel in low sugar products and still be scalable for commercial production. Pectin, a soluble fiber used mainly for gelling food products like jams and jellies, is naturally found in fruits and vegetables. Most commercial pectins are from citrus fruit peels and are extracted into a powder to act as a gelling agent in foods. Orange peels used to make pectin. (Photo by Wei Zhao, ARS) “Most commercially-available pectins successfully gel only when combined with high sugar products and acid,” said Wei Zhao, a research chemist from the U.S. Horticultural Research Laboratory in Fort Pierce, Florida. “For people seeking low sugar foods, most commercial pectins will not gel properly since a lot of sugar is needed for the gelling process. There are some commercial pectins that can gel in low sugar foods, but these alternatives tend to be low quality, are quite expensive to produce, and may contain undesirable residues.” Orange peels were shredded and then went through a simple high-pressure processing (HPP) treatment before being extracted for pectin. (Photo by Wei Zhao, ARS) In a recent study, Zhao and other ARS researchers found that they can pre-treat a fresh orange peel in a simple high-pressure processing (HPP) treatment and then extract pectin from that orange peel using a standard commercial method. The extracted pectin has desirable structural properties needed for gelling low sugar products without leaving undesirable residues. According to Zhao, the global market for pectin recently surpassed one billion dollars per year and is expected to reach over two billion dollars by 2025. The increasing demand for low sugar food products makes Zhao and her team’s pectin a desirable option for consumers. “Our research findings reveal the great potential of producing low-cost, high-quality pectins with increased gelling capacity by adding a simple HPP pre-treatment of fresh source material for pectin extraction,” said Zhao. The research findings were published in two journal papers in Food Hydrocolloids. Pectin extracted from a high-pressure processing (HPP) treated orange peel. (Photo by Wei Zhao, ARS) In addition to the U.S. Horticultural Research Laboratory, researchers from the ARS Western Regional Research Center in Albany, California, and ARS Eastern Regional Research Center in Wyndmoor, Pennsylvania, collaborated in the study. “This work catalyzes research engagement and demonstrates the first-class teamwork and collaborative partnership between ARS researchers,” said Jonn Foulk, an ARS National Program Leader for Nutrition, Food Safety, and Quality. “This work expanded and leveraged multidisciplinary expertise and resources between multiple geographically diverse (Florida, California, and Pennsylvania) locations to maximize research impact and expedite development of biobased innovations to address the evolving needs of the agricultural industry.” The Agricultural Research Service is the U.S. Department of Agriculture's chief scientific in-house research agency. Daily, ARS focuses on solutions to agricultural problems affecting America. Each dollar invested in U.S. agricultural research results in $20 of economic impact. "
July 1 2024,https://www.ars.usda.gov/news-events/news/research-news/2024/usda-university-researchers-develop-near-chromosome-level-genome-for-the-mojave-poppy-bee/,"USDA, University Researchers Develop Near Chromosome-Level Genome for the Mojave Poppy Bee",Jessica Ryan,Jessica.Ryan@usda.gov,"Putting together the Mojave poppy bee genome is part of the Beenome100 project, a first-of-its-kind effort to create a library of high-quality, highly detailed genome maps of 100 or more diverse bee species found in the United States. Beenome100 is a collaborative undertaking led by ARS and the University of Illinois, with collaboration of researchers across ARS and universities in the United States and Canada. The expectation is that these genomes will help researchers answer the big questions about bees, such as what genetic differences make a bee species more vulnerable to climate change or whether a bee species is likely to be more susceptible to a pesticide. Restricted to the eastern Mojave Desert, the Mojave poppy bee (Perdita meconis) is a solitary, mining bee of the Andrenidae family that specializes in pollinating the Las Vegas bearpoppy (Arctomecon californica) and the dwarf bearpoppy (Arctomecon humilis) — the latter being protected under the U.S. Endangered Species Act as of 1979. The poppies are found primarily in gypsum soil deposits, which are rare and scattered throughout the region. The Mojave poppy bee and Las Vegas bearpoppy are also being considered for listing under the Endangered Species Act. Both species will be evaluated for potential declining populations and vulnerability to extinction due to climate change and to habitat loss from urban development and mining in their native region. Researchers assembled the genome or genetic map that will help further to understand the Mojave poppy bee’s biological traits. A Mojave poppy bee female pinned specimen. (Photo by Michael Branstetter, ARS) ""The genome, with additional genetic sampling of individuals, will also potentially give us insights into the genetic basis for host-plant specialization, susceptibility to pesticides, and susceptibility to drought and climate tolerance,"" said Rena Schweizer, a research entomologist at the ARS Pollinating Insect-Biology, Management, Systematics Research Unit in Logan, Utah. In particular, the Mojave poppy bee is capable of weathering drought years by remaining in the ground in stasis — a phenomenon called diapause. The trait is not well understood by researchers and, by having its genome sequenced, they may be able to learn about the genes and regulatory pathways that make the adaptation possible. They will also use the genome to assess the species’ genetic health, find insights into how bees can be specialists or generalists, and look what the tradeoffs are in terms of a bee’s long-term fitness. ""It could also lead to us finding genetic signatures of decline,"" said Schweizer. ""By studying this one bee’s genome, we might be able to help conserve the bee better and identify other species that are in decline using genetic information."" A Mojave poppy bee male next to dime. (Photo by Chelsey Ritner, ARS) To develop the genome of the small and mighty bee, researchers isolated DNA from a single, small male specimen. This genome assembly, according to Schweizer, is impressive given that the bee is tiny (a male bee averages five to seven millimeters in length). Researchers collected the specimen in the field in a remote wilderness location.   ""What is also remarkable about this research is that the specimen used for the genome was collected in non-ideal preservation methods,"" said Schweizer. ""We still obtained high-quality DNA from a field-collected specimen due to technological advancements in sequencing technology and learned more about this unique bee. We hope that our research will set the groundwork for developing genomes of other bee species."" The detailed, high-resolution map of the reference genome is available in the National Center for Biotechnology Information’s database. The research was done in collaboration with the University of Montana, Utah State University, and the ARS Tropical Pest Genetics and Molecular Biology Research Unit in Hilo, Hawaii. The Agricultural Research Service is the U.S. Department of Agriculture's chief scientific in-house research agency. Daily, ARS focuses on solutions to agricultural problems affecting America. Each dollar invested in U.S. agricultural research results in $20 of economic impact. "
June 26 2024,https://www.ars.usda.gov/news-events/news/research-news/2024/exploring-water-solutions-for-a-better-future/,Exploring Water Solutions for a Better Future,Author not found,Email not found,"June 26, 2024 Scientists at the United States Department of Agriculture (USDA) Southwest Climate Hub and California Climate Hub have developed a browsable map-based tool that addresses water scarcity in the U.S. Southwest. The Water Adaptation Techniques Atlas (WATA) consolidates over 200 case studies on research and practices that water managers and producers can use to find location-specific and topical information to make informed decisions regarding water management. Over the years, urban areas and agriculture have expanded in the Southwest region. For the past century, water use in the Southwest has been sustained through the capture, storage, and distribution of surface water, aided by dams, canals, and associated infrastructure, while extraction of groundwater has also intensified. However, water scarcity has become a pressing issue with extremely hot temperatures and severe prolonged droughts in a region already challenged by its arid and semi-arid conditions. As reservoir and aquifer levels drop, information about strategies to adapt to this new reality is urgently needed. WATA provides information based on research from USDA's Agricultural Research Service (USDA-ARS) and other sources about practices for lessening the gap between water demand and available supply, with an emphasis on cropping and irrigation practices across the Southwest, including Arizona, California, Nevada, New Mexico, and Utah. Agronomist Jim Smart and Mexican farmers Miguel Morales Beltran and Hector Rodriquez Mediola discuss the 1996 drought that caused this irrigation ditch near Rio Bravo, Mexico, to dry up. (Photo by Jack Dykinga). The solutions documented in WATA include centuries-old techniques employed by the indigenous peoples of the Southwest region to grow crops in arid lands, as well as novel technologies such as aquaponics (integrating fish and plant crop production) and agrivoltaics (integrating solar energy and crop production). Several cases highlight tools and technologies for matching irrigation application to plant water needs using soil moisture sensors, remote sensing, or weather data. Dissemination of information about adaptation options is critical, as individuals, organizations, and communities look to take proactive measures to adapt to climate change. Managers, researchers, and educators can use the case studies, research outcomes, and practices available in WATA to identify new strategies to help mitigate the effects of temporary water shortage and expected longer-term water scarcity.   The development of WATA is an ongoing collaborative project that started in 2020 among USDA-ARS, USDA Southwest Climate Hub, USDA California Climate Hub, UC Davis Center for Watershed Sciences, and USDA’s Economic Research Service. Scientists will continue to incorporate new research findings and feedback from agricultural experts and others concerned with water scarcity in the Southwest. A recent article published in the journal PLOS Water titled “The water adaptation techniques atlas: A new geospatial library of solutions to water scarcity in the U.S. Southwest” provides additional details on the project. The Agricultural Research Service is the U.S. Department of Agriculture's chief scientific in-house research agency. Daily, ARS focuses on solutions to agricultural problems affecting America. Each dollar invested in U.S. agricultural research results in $20 of economic impact. "
